code,basePrice,isNew,createdAt,colorsZh,colorsVi,materialZh,materialVi,collarZh,collarVi,fitZh,fitVi,sellingPointsZh,sellingPointsVi
Ata-00001,10,TRUE,2025-04-04,"白色、黄色、米白色、安可拉红色、灰色、咖啡色、黑色、粉色、杏色、浅蓝色","Trắng, Vàng, Trắng kem, Đỏ angora, Xám, Nâu cà phê, Đen, Hồng, Kem, Xanh da trời nhạt","罗纹棉","Thun gân","圆领","Cổ tròn","短款辣妹修身款","Dáng ôm ngắn kiểu hot girl","复古印花款，吸睛好卖","Mẫu in retro, bắt mắt dễ bán"
Ata-00002,10,FALSE,2025-04-04,"白色、咖啡色、黑色、杏色、安可拉红色、粉色、灰色、黄色、浅蓝色","Trắng, Nâu cà phê, Đen, Kem, Đỏ angora, Hồng, Xám, Vàng, Xanh da trời nhạt","罗纹棉","Thun gân","圆领","Cổ tròn","短款辣妹修身款","Dáng ôm ngắn kiểu hot girl","字母基础款，走量稳定","Mẫu chữ cơ bản, đi đơn ổn định"
Ata-00003,10,TRUE,2025-04-04,"黑色、浅蓝色、米白色、白色、灰色、粉色、咖啡色、安可拉红色、黄色","Đen, Xanh da trời nhạt, Trắng kem, Trắng, Xám, Hồng, Nâu cà phê, Đỏ angora, Vàng","罗纹棉","Thun gân","圆领","Cổ tròn","短款辣妹修身款","Dáng ôm ngắn kiểu hot girl","手写字母款，简约高级好卖","Mẫu chữ viết tay, tối giản sang dễ bán"
Ata-00004,10,TRUE,2025-04-04,"黑色、白色、浅蓝色、浅黄色、咖啡色、灰色、粉色、安可拉红色、杏色","Đen, Trắng, Xanh da trời nhạt, Vàng nhạt, Nâu cà phê, Xám, Hồng, Đỏ angora, Kem","罗纹棉","Thun gân","圆领","Cổ tròn","短款辣妹修身款","Dáng ôm ngắn kiểu hot girl","彩色字母款，减龄好出单","Mẫu chữ nhiều màu, trẻ trung dễ chốt đơn"
Ata-00005,10,TRUE,2025-04-04,"安可拉红色、浅黄色、粉色、浅蓝色、白色、灰色、杏色、黑色、咖啡色","Đỏ angora, Vàng nhạt, Hồng, Xanh da trời nhạt, Trắng, Xám, Kem, Đen, Nâu cà phê","罗纹棉","Thun gân","圆领","Cổ tròn","短款辣妹修身款","Dáng ôm ngắn kiểu hot girl","法式印花款，氛围感强好卖","Mẫu in phong cách Pháp, lên vibe đẹp dễ bán"
Ata-00006,10,TRUE,2025-04-04,"白色、黑色、浅蓝色、咖啡色、杏色、安可拉红色、粉色、黄色、灰色","Trắng, Đen, Xanh da trời nhạt, Nâu cà phê, Kem, Đỏ angora, Hồng, Vàng, Xám","罗纹棉","Thun gân","圆领","Cổ tròn","短款辣妹修身款","Dáng ôm ngắn kiểu hot girl","条纹设计款，小众显身材","Mẫu thiết kế sọc, lạ mắt tôn dáng"
Atb-00001,11,TRUE,2025-04-04,"白色、灰色、粉色、黑色、杏色、安可拉红色","Trắng, Xám, Hồng, Đen, Kem, Đỏ angora","罗纹棉","Thun gân","圆领","Cổ tròn","短款辣妹修身款","Dáng ôm ngắn kiểu hot girl","蝴蝶结刺绣款，甜美百搭","Mẫu thêu nơ, ngọt ngào dễ phối"
Atb-00002,11,FALSE,2025-04-04,"白色、黑色、粉色、杏色、灰色、安可拉红色","Trắng, Đen, Hồng, Kem, Xám, Đỏ angora","罗纹棉","Thun gân","圆领","Cổ tròn","短款辣妹修身款","Dáng ôm ngắn kiểu hot girl","小马刺绣款，复古质感好卖","Mẫu thêu ngựa nhỏ, retro chất đẹp dễ bán"
Atb-00003,11,TRUE,2025-04-04,"白色、黑色、杏色、安可拉红色、灰色、粉色","Trắng, Đen, Kem, Đỏ angora, Xám, Hồng","罗纹棉","Thun gân","圆领","Cổ tròn","短款辣妹修身款","Dáng ôm ngắn kiểu hot girl","小狗刺绣款，减龄好出单","Mẫu thêu chó nhỏ, trẻ trung dễ chốt đơn"
Atb-00004,11,TRUE,2025-04-04,"白色、黑色、粉色、杏色、灰色、安可拉红色","Trắng, Đen, Hồng, Kem, Xám, Đỏ angora","罗纹棉","Thun gân","圆领","Cổ tròn","短款辣妹修身款","Dáng ôm ngắn kiểu hot girl","斑马刺绣款，小众吸睛好卖","Mẫu thêu ngựa vằn, lạ mắt bắt mắt dễ bán"
Atb-00005,11,TRUE,2025-04-04,"白色、黑色、安可拉红色、灰色、粉色、杏色","Trắng, Đen, Đỏ angora, Xám, Hồng, Kem","罗纹棉","Thun gân","圆领","Cổ tròn","短款辣妹修身款","Dáng ôm ngắn kiểu hot girl","笑脸刺绣款，活力好出单","Mẫu thêu mặt cười, năng động dễ chốt đơn"
Atb-00006,11,TRUE,2025-04-04,"白色、黑色、安可拉红色、灰色、粉色、杏色","Trắng, Đen, Đỏ angora, Xám, Hồng, Kem","罗纹棉","Thun gân","圆领","Cổ tròn","短款辣妹修身款","Dáng ôm ngắn kiểu hot girl","蘑菇刺绣款，软萌减龄好卖","Mẫu thêu nấm, mềm xinh trẻ trung dễ bán"
Atb-00007,11,TRUE,2025-04-04,"白色、黑色、粉色、杏色、灰色、安可拉红色","Trắng, Đen, Hồng, Kem, Xám, Đỏ angora","罗纹棉","Thun gân","圆领","Cổ tròn","短款辣妹修身款","Dáng ôm ngắn kiểu hot girl","企鹅刺绣款，清新百搭好卖","Mẫu thêu chim cánh cụt, tươi tắn dễ phối dễ bán"
Atb-00008,11,TRUE,2025-04-04,"白色、黑色、安可拉红色、灰色、粉色、杏色","Trắng, Đen, Đỏ angora, Xám, Hồng, Kem","罗纹棉","Thun gân","圆领","Cổ tròn","短款辣妹修身款","Dáng ôm ngắn kiểu hot girl","自行车刺绣款，个性吸睛","Mẫu thêu xe đạp, cá tính bắt mắt"
Atb-00009,11,TRUE,2025-04-04,"白色、黑色、安可拉红色、灰色、粉色、杏色","Trắng, Đen, Đỏ angora, Xám, Hồng, Kem","罗纹棉","Thun gân","圆领","Cổ tròn","短款辣妹修身款","Dáng ôm ngắn kiểu hot girl","创意小马刺绣款，小众不撞款","Mẫu thêu ngựa sáng tạo, lạ mắt ít đụng hàng"
Atb-00010,11,TRUE,2025-04-04,"白色、粉色、黄色、灰色、咖啡色、安可拉红色、浅蓝色、黑色","Trắng, Hồng, Vàng, Xám, Nâu cà phê, Đỏ angora, Xanh da trời nhạt, Đen","罗纹棉","Thun gân","圆领","Cổ tròn","弧形短款辣妹修身款","Dáng ôm ngắn lai cong kiểu hot girl","字母基础款，通勤走量稳定","Mẫu chữ cơ bản, mặc đi làm đi đơn ổn định"
Atb-00011,11,TRUE,2025-04-04,"浅黄色、浅蓝色、粉色、杏色、白色、安可拉红色、灰色、咖啡色、黑色","Vàng nhạt, Xanh da trời nhạt, Hồng, Kem, Trắng, Đỏ angora, Xám, Nâu cà phê, Đen","罗纹棉","Thun gân","圆领","Cổ tròn","弧形短款辣妹修身款","Dáng ôm ngắn lai cong kiểu hot girl","兔子字母款，减龄好出单","Mẫu chữ hình thỏ, trẻ trung dễ chốt đơn"
Atb-00012,11,TRUE,2025-04-04,"安可拉红色、咖啡色、杏色、粉色、黄色、白色、灰色、浅蓝色、黑色","Đỏ angora, Nâu cà phê, Kem, Hồng, Vàng, Trắng, Xám, Xanh da trời nhạt, Đen","罗纹棉","Thun gân","圆领","Cổ tròn","弧形短款辣妹修身款","Dáng ôm ngắn lai cong kiểu hot girl","字母基础款，百搭走量","Mẫu chữ cơ bản, dễ phối dễ bán"
Atb-00013,11,TRUE,2025-04-04,"浅蓝色、杏色、咖啡色、粉色、白色、安可拉红色、灰色、黑色、浅黄色","Xanh da trời nhạt, Kem, Nâu cà phê, Hồng, Trắng, Đỏ angora, Xám, Đen, Vàng nhạt","罗纹棉","Thun gân","圆领","Cổ tròn","弧形短款辣妹修身款","Dáng ôm ngắn lai cong kiểu hot girl","巴士印花款，小众个性好卖","xe buýtinmẫu, lạ mắtcá tínhdễ bán"
Atb-00014,11,TRUE,2025-04-05,"杏色、粉色、浅黄色、咖啡色、安可拉红色、白色、灰色、浅蓝色、黑色","Kem, Hồng, Vàng nhạt, Nâu cà phê, Đỏ angora, Trắng, Xám, Xanh da trời nhạt, Đen","罗纹棉","Thun gân","圆领","Cổ tròn","弧形短款辣妹修身款","Dáng ôm ngắn lai cong kiểu hot girl","趣味字母款，减龄好出单","ngộ nghĩnhchữmẫu, trẻ trung好chốt đơn"
Atb-00015,11,TRUE,2025-04-05,"安可拉红色、黄色、粉色、浅蓝色、黑色、咖啡色、杏色、白色、灰色","Đỏ angora, Vàng, Hồng, Xanh da trời nhạt, Đen, Nâu cà phê, Kem, Trắng, Xám","罗纹棉","Thun gân","圆领","Cổ tròn","弧形短款辣妹修身款","Dáng ôm ngắn lai cong kiểu hot girl","热气球印花款，软萌好卖","热气球inmẫu, mềm xinhdễ bán"
Atb-00016,11,TRUE,2025-04-05,"黄色、粉色、安可拉红色、浅蓝色、灰色、黑色、杏色、白色、咖啡色","Vàng, Hồng, Đỏ angora, Xanh da trời nhạt, Xám, Đen, Kem, Trắng, Nâu cà phê","罗纹棉","Thun gân","圆领","Cổ tròn","弧形短款辣妹修身款","Dáng ôm ngắn lai cong kiểu hot girl","潮流字母款，显身材好卖","潮流chữmẫu, tôn dángdễ bán"
Atb-00017,11,TRUE,2025-04-05,"安可拉红色、杏色、粉色、白色、黑色、花灰色","Đỏ angora, Kem, Hồng, Trắng, Đen, Xám muối tiêu","罗纹棉","Thun gân","圆领","Cổ tròn","短款辣妹修身款","Dáng ôm ngắn kiểu hot girl","字母刺绣款，基础百搭","chữthêumẫu, Cơ bản dễ phối"
Atb-00018,11,TRUE,2025-04-05,"安可拉红色、杏色、粉色、白色、黑色、花灰色","Đỏ angora, Kem, Hồng, Trắng, Đen, Xám muối tiêu","罗纹棉","Thun gân","圆领","Cổ tròn","短款辣妹修身款","Dáng ôm ngắn kiểu hot girl","蜜蜂刺绣款，减龄吸睛","蜜蜂thêumẫu, trẻ trungbắt mắt"
Atb-00019,11,TRUE,2025-04-05,"安可拉红色、杏色、黑色、粉色、灰色、白色、果绿色、浅蓝色、黄色","Đỏ angora, Kem, Đen, Hồng, Xám, Trắng, Xanh trái cây, Xanh da trời nhạt, Vàng","罗纹棉","Thun gân","圆领","Cổ tròn","短款辣妹修身款","Dáng ôm ngắn kiểu hot girl","字母基础款，多场景走量","chữmẫu cơ bản, 多场景dễ bán"
Atb-00020,11,TRUE,2025-04-05,"浅蓝色、果绿色、黑色、白色、安可拉红色、杏色、粉色、灰色","Xanh da trời nhạt, Xanh trái cây, Đen, Trắng, Đỏ angora, Kem, Hồng, Xám","罗纹棉","Thun gân","圆领","Cổ tròn","短款辣妹修身款","Dáng ôm ngắn kiểu hot girl","创意字母款，个性不撞款","创意chữmẫu, cá tínhít đụng hàng"
Atb-00021,11,TRUE,2025-04-05,"安可拉红色、粉色、杏色、白色、黑色、花灰色","Đỏ angora, Hồng, Kem, Trắng, Đen, Xám muối tiêu","罗纹棉","Thun gân","圆领","Cổ tròn","短款辣妹修身款","Dáng ôm ngắn kiểu hot girl","字母刺绣款，稳定好卖","chữthêumẫu, 稳定dễ bán"
Atc-00001,12,TRUE,2025-04-05,"藏青色、黑色、白色、粉色、咖啡色、灰色、安可拉红色","Xanh navy, Đen, Trắng, Hồng, Nâu cà phê, Xám, Đỏ angora","罗纹棉","Thun gân","圆领","Cổ tròn","短款辣妹修身款","Dáng ôm ngắn kiểu hot girl","小狗烫钻款，吸睛好出单","chó nhỏ烫钻mẫu, bắt mắt好chốt đơn"
Atc-00002,12,TRUE,2025-04-05,"黑色、白色、粉色、咖啡色、灰色、安可拉红色","Đen, Trắng, Hồng, Nâu cà phê, Xám, Đỏ angora","罗纹棉","Thun gân","圆领","Cổ tròn","短款辣妹修身款","Dáng ôm ngắn kiểu hot girl","字母烫钻款，显身材好卖","chữ烫钻mẫu, tôn dángdễ bán"
Atc-00003,12,TRUE,2025-04-05,"白色、黑色、粉色、咖啡色、灰色、安可拉红色","Trắng, Đen, Hồng, Nâu cà phê, Xám, Đỏ angora","罗纹棉","Thun gân","圆领","Cổ tròn","短款辣妹修身款","Dáng ôm ngắn kiểu hot girl","蝴蝶结烫钻款，甜妹必拿","nơ烫钻mẫu, 甜妹必拿"
Atc-00004,12,TRUE,2025-04-05,"黑色、白色、粉色、咖啡色、灰色、安可拉红色","Đen, Trắng, Hồng, Nâu cà phê, Xám, Đỏ angora","罗纹棉","Thun gân","圆领","Cổ tròn","短款辣妹修身款","Dáng ôm ngắn kiểu hot girl","字母烫钻款，基础好卖","chữ烫钻mẫu, cơ bảndễ bán"
Atc-00005,12,TRUE,2025-04-05,"黑色、白色、安可拉红色、咖啡色、粉色、灰色","Đen, Trắng, Đỏ angora, Nâu cà phê, Hồng, Xám","罗纹棉","Thun gân","圆领","Cổ tròn","短款辣妹修身款","Dáng ôm ngắn kiểu hot girl","小马烫钻款，复古质感强","ngựa nhỏ烫钻mẫu, retrochất强"
Atc-00006,12,TRUE,2025-04-05,"白色、黑色、安可拉红色、粉色、咖啡色、灰色","Trắng, Đen, Đỏ angora, Hồng, Nâu cà phê, Xám","罗纹棉","Thun gân","圆领","Cổ tròn","短款辣妹修身款","Dáng ôm ngắn kiểu hot girl","爱心烫钻款，甜酷好出单","trái tim烫钻mẫu, 甜酷好chốt đơn"
Atc-00007,12,TRUE,2025-04-05,"白色、黑色、安可拉红色、粉色、咖啡色、灰色","Trắng, Đen, Đỏ angora, Hồng, Nâu cà phê, Xám","罗纹棉","Thun gân","圆领","Cổ tròn","短款辣妹修身款","Dáng ôm ngắn kiểu hot girl","爱心烫钻款，甜酷稳定卖","trái tim烫钻mẫu, 甜酷稳定卖"
Atc-00008,12,TRUE,2025-04-05,"白色、黑色、粉色、咖啡色、灰色、安可拉红色","Trắng, Đen, Hồng, Nâu cà phê, Xám, Đỏ angora","罗纹棉","Thun gân","圆领","Cổ tròn","短款辣妹修身款","Dáng ôm ngắn kiểu hot girl","月亮烫钻款，潮流不撞款","月亮烫钻mẫu, 潮流ít đụng hàng"
Atc-00009,12,TRUE,2025-04-05,"白色、黑色、粉色、灰色、安可拉红色、咖啡色","Trắng, Đen, Hồng, Xám, Đỏ angora, Nâu cà phê","罗纹棉","Thun gân","圆领","Cổ tròn","短款辣妹修身款","Dáng ôm ngắn kiểu hot girl","人像印花款，复古个性好卖","人像inmẫu, retrocá tínhdễ bán"
Atc-00010,12,TRUE,2025-04-05,"白色、黑色、粉色、灰色、安可拉红色、咖啡色","Trắng, Đen, Hồng, Xám, Đỏ angora, Nâu cà phê","罗纹棉","Thun gân","圆领","Cổ tròn","短款辣妹修身款","Dáng ôm ngắn kiểu hot girl","人像字母款，复古百搭","人像chữmẫu, Retro dễ phối"
Atc-00011,12,TRUE,2025-04-05,"白色、黑色、粉色、灰色、安可拉红色、杏色","Trắng, Đen, Hồng, Xám, Đỏ angora, Kem","罗纹棉","Thun gân","圆领","Cổ tròn","短款辣妹修身款","Dáng ôm ngắn kiểu hot girl","人像字母款，个性风格强","人像chữmẫu, cá tính风格强"
Atc-00012,12,TRUE,2025-04-05,"白色、黑色、粉色、灰色、安可拉红色、杏色","Trắng, Đen, Hồng, Xám, Đỏ angora, Kem","罗纹棉","Thun gân","圆领","Cổ tròn","短款辣妹修身款","Dáng ôm ngắn kiểu hot girl","1987人像款，复古潮流好卖","1987人像mẫu, retro潮流dễ bán"
Atc-00013,12,TRUE,2025-04-05,"白色、黑色、粉色、灰色、安可拉红色、杏色","Trắng, Đen, Hồng, Xám, Đỏ angora, Kem","罗纹棉","Thun gân","圆领","Cổ tròn","短款辣妹修身款","Dáng ôm ngắn kiểu hot girl","双人人像款，个性复古吸睛","双人人像mẫu, cá tínhretrobắt mắt"
Atc-00014,12,TRUE,2025-04-05,"白色、黑色、粉色、安可拉红色、杏色、灰色","Trắng, Đen, Hồng, Đỏ angora, Kem, Xám","罗纹棉","Thun gân","圆领","Cổ tròn","短款辣妹修身款","Dáng ôm ngắn kiểu hot girl","复古人像字母款，通勤好卖","retro人像chữmẫu, đi làmdễ bán"
Atc-00015,12,TRUE,2025-04-05,"白色、黑色、黄色、灰色、浅蓝色","Trắng, Đen, Vàng, Xám, Xanh da trời nhạt","罗纹棉","Thun gân","U 领","Cổ U","短款辣妹修身款","Dáng ôm ngắn kiểu hot girl","字母基础款，通勤走量","chữmẫu cơ bản, đi làmdễ bán"
Atc-00016,12,FALSE,2025-04-05,"白色、黑色、黄色、灰色、浅蓝色","Trắng, Đen, Vàng, Xám, Xanh da trời nhạt","罗纹棉","Thun gân","U 领","Cổ U","短款辣妹修身款","Dáng ôm ngắn kiểu hot girl","字母刺绣款，稳定百搭","chữthêumẫu, 稳定dễ phối"
Atc-00017,12,FALSE,2025-04-05,"白色、黑色、黄色、藏青色、安可拉红色、杏色、灰色、粉色、浅蓝色","Trắng, Đen, Vàng, Xanh navy, Đỏ angora, Kem, Xám, Hồng, Xanh da trời nhạt","罗纹棉","Thun gân","圆领","Cổ tròn","短款辣妹修身款","Dáng ôm ngắn kiểu hot girl","链条装饰款，潮流吸睛","链条装饰mẫu, 潮流bắt mắt"
Atc-00018,12,FALSE,2025-04-06,"白色、黑色、黄色、安可拉红色、咖啡色、杏色、灰色、粉色、浅蓝色","Trắng, Đen, Vàng, Đỏ angora, Nâu cà phê, Kem, Xám, Hồng, Xanh da trời nhạt","罗纹棉","Thun gân","圆领","Cổ tròn","短款辣妹修身款","Dáng ôm ngắn kiểu hot girl","可调链条款，甜酷百搭","可调链条mẫu, 甜酷dễ phối"
Atc-00019,12,FALSE,2025-04-06,"白色、黑色、灰色、安可拉红色、藏青色、杏色、粉色、黄色、浅蓝色","Trắng, Đen, Xám, Đỏ angora, Xanh navy, Kem, Hồng, Vàng, Xanh da trời nhạt","罗纹棉","Thun gân","V 领","Cổ V","短款辣妹修身款","Dáng ôm ngắn kiểu hot girl","V领修身款，显瘦好出单","V领修身mẫu, tôn dáng好chốt đơn"
Atc-00020,12,FALSE,2025-04-06,"白色、黑色、粉色、安可拉红色、藏青色、黄色","Trắng, Đen, Hồng, Đỏ angora, Xanh navy, Vàng","罗纹棉","Thun gân","一字肩","Trễ vai ngang","短款辣妹修身款","Dáng ôm ngắn kiểu hot girl","美式字母款，辣妹客群好卖","美式chữmẫu, 辣妹客群dễ bán"
Atc-00021,12,FALSE,2025-04-06,"红色、白色、黑色、黄色、藏蓝色、粉色、浅蓝色","Đỏ, Trắng, Đen, Vàng, 藏Xanh, Hồng, Xanh da trời nhạt","罗纹棉","Thun gân","斜肩领","Cổ lệch vai","短款辣妹修身款","Dáng ôm ngắn kiểu hot girl","露肩款，显瘦吸睛","露肩mẫu, tôn dángbắt mắt"
Atc-00022,12,FALSE,2025-04-06,"白色、黑色、藏蓝色、米色、棕色、灰色","Trắng, Đen, 藏Xanh, Be, Nâu, Xám","罗纹棉","Thun gân","露肩圆领","Cổ tròn hở vai","短款辣妹修身款","Dáng ôm ngắn kiểu hot girl","字母基础款，稳定走量","chữmẫu cơ bản, 稳定dễ bán"
Atc-00023,12,FALSE,2025-04-06,"红色、蓝色、黄色、白色、灰色","Đỏ, Xanh dương, Vàng, Trắng, Xám","罗纹棉","Thun gân","圆领拼色","Cổ tròn phối màu","短款修身款","Dáng ôm ngắn","撞色设计款，吸睛好卖","撞色设计mẫu, bắt mắtdễ bán"
Atc-00024,12,FALSE,2025-04-06,"白色、黑色、灰色、米色、深蓝色、棕色","Trắng, Đen, Xám, Be, Xanh đậm, Nâu","罗纹棉","Thun gân","斜肩领","Cổ lệch vai","短款辣妹修身款","Dáng ôm ngắn kiểu hot girl","涂鸦印花款，个性不撞款","涂鸦inmẫu, cá tínhít đụng hàng"
Atc-00025,12,FALSE,2025-04-06,"黑色、白色、灰色、蓝色、棕色、酒红色、米色","Đen, Trắng, Xám, Xanh dương, Nâu, Đỏ rượu vang, Be","罗纹棉","Thun gân","半高领","Cổ nửa cao","修身开叉款","Dáng ôm xẻ tà","开叉设计款，显腿长好卖","开叉设计mẫu, 显腿长dễ bán"
Atc-00026,12,FALSE,2025-04-06,"白色、黑色、灰色、蓝色、棕色、酒红色、米色","Trắng, Đen, Xám, Xanh dương, Nâu, Đỏ rượu vang, Be","罗纹棉","Thun gân","半高领","Cổ nửa cao","修身中长款","Dáng ôm dài vừa","字母基础款，百搭走量","Mẫu chữ cơ bản, dễ phối dễ bán"
Atc-00027,12,FALSE,2025-04-06,"黑色、白色、灰色、蓝色、棕色、酒红色、米色","Đen, Trắng, Xám, Xanh dương, Nâu, Đỏ rượu vang, Be","罗纹棉","Thun gân","半高领","Cổ nửa cao","修身款","Dáng ôm","基础款，补货首选","mẫu cơ bản, 补货首选"
Atc-00028,12,FALSE,2025-04-06,"黑色、白色、灰色、蓝色、棕色、酒红色、米色","Đen, Trắng, Xám, Xanh dương, Nâu, Đỏ rượu vang, Be","罗纹棉","Thun gân","半高领","Cổ nửa cao","修身后开叉款","Dáng ôm xẻ sau","后背开叉款，设计感强好卖","后背开叉mẫu, có điểm nhấn强dễ bán"
Atc-00029,12,FALSE,2025-04-06,"白色、黑色、灰色、粉色、军绿色","Trắng, Đen, Xám, Hồng, Xanh quân đội","罗纹棉","Thun gân","圆领镂空","Cổ tròn khoét hở","短款修身款","Dáng ôm ngắn","前胸镂空款，吸睛好出单","前胸镂空mẫu, bắt mắt好chốt đơn"
Atc-00030,12,FALSE,2025-04-06,"白色、黑色、灰色、蓝色、棕色、酒红色、米色","Trắng, Đen, Xám, Xanh dương, Nâu, Đỏ rượu vang, Be","罗纹棉","Thun gân","半高领镂空","Cổ nửa cao khoét hở","修身短款","Dáng ôm ngắn","镂空设计款，显瘦有卖点","镂空设计mẫu, tôn dáng有卖点"
Atc-00031,12,FALSE,2025-04-06,"白色、黑色、灰色、藏蓝色、棕色、酒红色、米色","Trắng, Đen, Xám, 藏Xanh, Nâu, Đỏ rượu vang, Be","罗纹棉","Thun gân","半高领","Cổ nửa cao","修身款","Dáng ôm","半高领纯色修身剪裁，通勤客群稳定拿货","半高领纯色修身剪裁, đi làm客群稳定拿货"
Atc-00032,12,FALSE,2025-04-06,"白色、黑色、灰色、粉色、杏色、枣红色","Trắng, Đen, Xám, Hồng, Kem, Đỏ táo tàu","罗纹棉","Thun gân","圆领","Cổ tròn","修身款","Dáng ôm","字母小狗印花结合基础版型，减龄款好出单","chữchó nhỏin结合cơ bản版型, trẻ trungmẫu好chốt đơn"
Atc-00033,12,FALSE,2025-04-06,"白色、黑色、灰色、粉色、杏色、枣红色","Trắng, Đen, Xám, Hồng, Kem, Đỏ táo tàu","罗纹棉","Thun gân","圆领","Cổ tròn","修身款","Dáng ôm","彩色动物排印搭配修身剪裁，陈列吸睛促转化","nhiều màu动物排印搭配修身剪裁, 陈列bắt mắt促转化"
Atc-00034,12,FALSE,2025-04-07,"白色、黑色、灰色、粉色、杏色、枣红色","Trắng, Đen, Xám, Hồng, Kem, Đỏ táo tàu","罗纹棉","Thun gân","圆领","Cổ tròn","修身款","Dáng ôm","手绘爱心图案结合基础剪裁，软萌风好出单","手绘trái timhọa tiết结合cơ bản剪裁, mềm xinh风好chốt đơn"
Atc-00035,12,FALSE,2025-04-07,"白色、黑色、灰色、粉色、杏色、枣红色","Trắng, Đen, Xám, Hồng, Kem, Đỏ táo tàu","罗纹棉","Thun gân","圆领","Cổ tròn","修身款","Dáng ôm","英文字母印花叠加修身版型，通勤客群易成交","英文chữin叠加修身版型, đi làm客群易成交"
Atc-00036,12,FALSE,2025-04-07,"白色、黑色、灰色、粉色、杏色、枣红色","Trắng, Đen, Xám, Hồng, Kem, Đỏ táo tàu","罗纹棉","Thun gân","圆领","Cổ tròn","修身款","Dáng ôm","小红标刺绣结合短款剪裁，基础款提升复购","小红标thêu结合短mẫu剪裁, mẫu cơ bản提升复购"
Atc-00037,12,FALSE,2025-04-07,"白色、黑色、灰色、粉色、杏色、枣红色","Trắng, Đen, Xám, Hồng, Kem, Đỏ táo tàu","罗纹棉","Thun gân","圆领","Cổ tròn","修身款","Dáng ôm","小动物刺绣点缀修身版型，精致款提升客单","小动物thêu点缀修身版型, 精致mẫu提升客单"
Atc-00038,12,FALSE,2025-04-07,"白色、黑色、灰色、粉色、杏色、枣红色","Trắng, Đen, Xám, Hồng, Kem, Đỏ táo tàu","罗纹棉","Thun gân","圆领","Cổ tròn","修身款","Dáng ôm","卡通字母印花结合修身短版，年轻客群好卖","卡通chữin结合修身短版, 年轻客群dễ bán"
Atc-00039,12,FALSE,2025-04-07,"白色、黑色、灰色、粉色、杏色、枣红色","Trắng, Đen, Xám, Hồng, Kem, Đỏ táo tàu","罗纹棉","Thun gân","圆领","Cổ tròn","修身款","Dáng ôm","极简小刺绣叠加修身版型，基础款稳定走量","极简小thêu叠加修身版型, mẫu cơ bản稳定dễ bán"
Atc-00040,12,FALSE,2025-04-07,"白色、黑色、灰色、粉色、杏色、枣红色","Trắng, Đen, Xám, Hồng, Kem, Đỏ táo tàu","罗纹棉","Thun gân","圆领","Cổ tròn","修身款","Dáng ôm","极简小图案搭配修身版型，补货款持续走量","极简小họa tiết搭配修身版型, 补货mẫu持续dễ bán"
Atc-00041,12,FALSE,2025-04-04,"杏色、枣红色、白色、花灰色、黑色、粉色","Kem, Đỏ táo tàu, Trắng, Xám muối tiêu, Đen, Hồng","罗纹棉","Thun gân","圆领","Cổ tròn","修身款","Dáng ôm","小马刺绣配修身版型，基础款补货快","ngựa nhỏthêu配修身版型, mẫu cơ bản补货快"
Atc-00042,12,FALSE,2025-04-04,"咖啡色、枣红色、杏色、黑色、浅黄色、浅蓝色、白色、粉色","Nâu cà phê, Đỏ táo tàu, Kem, Đen, Vàng nhạt, Xanh da trời nhạt, Trắng, Hồng","罗纹棉","Thun gân","圆领","Cổ tròn","修身款","Dáng ôm","极简字母配修身剪裁，通勤客群易成交","极简chữ配修身剪裁, đi làm客群易成交"
Atc-00043,12,FALSE,2025-04-05,"枣红色、杏色、黑色、白色、花灰色、浅蓝色、果绿色、粉色","Đỏ táo tàu, Kem, Đen, Trắng, Xám muối tiêu, Xanh da trời nhạt, Xanh trái cây, Hồng","罗纹棉","Thun gân","圆领","Cổ tròn","辣妹修身款","Dáng ôm kiểu hot girl","手写字母配辣妹修身，年轻客更愿试穿","viết taychữ配辣妹修身, 年轻客更愿试穿"
Atc-00044,12,FALSE,2025-04-05,"枣红色、浅蓝色、粉色、杏色、咖啡色、浅黄色、黑色、白色","Đỏ táo tàu, Xanh da trời nhạt, Hồng, Kem, Nâu cà phê, Vàng nhạt, Đen, Trắng","罗纹棉","Thun gân","圆领","Cổ tròn","修身款","Dáng ôm","彩块字母配修身版型，陈列更吸睛好卖","彩块chữ配修身版型, 陈列更bắt mắtdễ bán"
